{
  "schema_version": "1.0.0",
  "check_id": "identity-check:routing:orchestration:synthetic-prose-strategy:v1:2",
  "checked_at": "2026-08-31T18:05:00+02:00",
  "routing_decision_ref": "routing:orchestration:synthetic-prose-strategy:v1:2",
  "guard_mode": "PRESERVE_EXISTING",
  "before_identity": {
    "research_question": {
      "status": "DEFINED",
      "statement": "Can the source strategy be reconstructed and operationalized without silently adding conditions?"
    },
    "strategy": {
      "status": "DEFINED",
      "statement": "VWAP Wave price-discovery breakout reconstructed from the supplied prose."
    },
    "market": {
      "status": "DEFINED",
      "statement": "U.S. equity-index futures during the regular trading session."
    },
    "time_horizon": {
      "status": "DEFINED",
      "statement": "Intraday; entry and outcome occur within the same regular session."
    },
    "trigger": {
      "status": "UNRESOLVED",
      "statement": "The source requires a clear range break beyond the one-sigma VWAP band with strong volume but does not define every threshold."
    },
    "target": {
      "status": "UNRESOLVED",
      "statement": "The source offers the two-sigma band, a prior-range projection, fixed reward-risk, and trailing management without selecting one primary outcome."
    }
  },
  "after_identity": {
    "research_question": {
      "status": "DEFINED",
      "statement": "Can the source strategy be reconstructed and operationalized without silently adding conditions?"
    },
    "strategy": {
      "status": "DEFINED",
      "statement": "VWAP Wave price-discovery breakout reconstructed from the supplied prose."
    },
    "market": {
      "status": "DEFINED",
      "statement": "U.S. equity-index futures during the regular trading session."
    },
    "time_horizon": {
      "status": "DEFINED",
      "statement": "Intraday; entry and outcome occur within the same regular session."
    },
    "trigger": {
      "status": "UNRESOLVED",
      "statement": "The source requires a clear range break beyond the one-sigma VWAP band with strong volume but does not define every threshold."
    },
    "target": {
      "status": "UNRESOLVED",
      "statement": "The source offers the two-sigma band, a prior-range projection, fixed reward-risk, and trailing management without selecting one primary outcome."
    }
  },
  "comparisons": [
    {
      "dimension": "research_question",
      "before": {
        "status": "DEFINED",
        "statement": "Can the source strategy be reconstructed and operationalized without silently adding conditions?"
      },
      "after": {
        "status": "DEFINED",
        "statement": "Can the source strategy be reconstructed and operationalized without silently adding conditions?"
      },
      "status": "UNCHANGED"
    },
    {
      "dimension": "strategy",
      "before": {
        "status": "DEFINED",
        "statement": "VWAP Wave price-discovery breakout reconstructed from the supplied prose."
      },
      "after": {
        "status": "DEFINED",
        "statement": "VWAP Wave price-discovery breakout reconstructed from the supplied prose."
      },
      "status": "UNCHANGED"
    },
    {
      "dimension": "market",
      "before": {
        "status": "DEFINED",
        "statement": "U.S. equity-index futures during the regular trading session."
      },
      "after": {
        "status": "DEFINED",
        "statement": "U.S. equity-index futures during the regular trading session."
      },
      "status": "UNCHANGED"
    },
    {
      "dimension": "time_horizon",
      "before": {
        "status": "DEFINED",
        "statement": "Intraday; entry and outcome occur within the same regular session."
      },
      "after": {
        "status": "DEFINED",
        "statement": "Intraday; entry and outcome occur within the same regular session."
      },
      "status": "UNCHANGED"
    },
    {
      "dimension": "trigger",
      "before": {
        "status": "UNRESOLVED",
        "statement": "The source requires a clear range break beyond the one-sigma VWAP band with strong volume but does not define every threshold."
      },
      "after": {
        "status": "UNRESOLVED",
        "statement": "The source requires a clear range break beyond the one-sigma VWAP band with strong volume but does not define every threshold."
      },
      "status": "UNCHANGED"
    },
    {
      "dimension": "target",
      "before": {
        "status": "UNRESOLVED",
        "statement": "The source offers the two-sigma band, a prior-range projection, fixed reward-risk, and trailing management without selecting one primary outcome."
      },
      "after": {
        "status": "UNRESOLVED",
        "statement": "The source offers the two-sigma band, a prior-range projection, fixed reward-risk, and trailing management without selecting one primary outcome."
      },
      "status": "UNCHANGED"
    }
  ],
  "overall_status": "UNCHANGED",
  "changed_dimensions": [],
  "plain_language_summary": "The handoff preserved the research question, strategy, market, time horizon, trigger, and target.",
  "handoff_may_be_accepted": true
}
